{
  "schema": "https://raw.githubusercontent.com/FAIR-bioHeaders/FHR-Specification/main/fhr.json",
  "schemaVersion": 1.0,
  "taxon": {
    "name": "Homo sapiens",
    "uri": "https://identifiers.org/taxonomy:9606"
  },
  "genome": "Synthetic export example",
  "version": "1.0.0",
  "metadataAuthor": [
    {
      "name": "Josiah Carberry",
      "uri": "https://orcid.org/0000-0002-1825-0097"
    }
  ],
  "assemblyAuthor": [
    {
      "name": "Synthetic assembly author (placeholder)"
    }
  ],
  "dateCreated": "2026-10-14",
  "masking": "soft-masked",
  "checksum": "AAAAAAAAAAAAAAAAAAAAAAAAAAAAAAAAAAAAAAAAAAA=",
  "assemblySoftware": [
    {
      "name": "hifiasm",
      "version": "0.19.8",
      "uri": "https://github.com/chhylp123/hifiasm",
      "commandLineOption": [
        "-t",
        "32"
      ]
    }
  ],
  "instrument": [
    "Example sequencer"
  ],
  "assemblyProtocol": "https://example.org/assembly-protocol"
}
