{
  "schema": "https://raw.githubusercontent.com/FAIR-bioHeaders/FHR-Specification/main/fhr.json",
  "schemaVersion": 1.0,
  "taxon": {
    "name": "Homo sapiens",
    "uri": "https://identifiers.org/taxonomy:9606"
  },
  "genome": "Synthetic human reference example",
  "genomeSynonym": [
    "synthetic example"
  ],
  "version": "0.0.1",
  "metadataAuthor": [
    {
      "name": "Adam Wright",
      "uri": "https://orcid.org/0000-0002-5719-4024",
      "nameType": "Personal"
    }
  ],
  "assemblyAuthor": [
    {
      "name": "David Molik",
      "uri": "https://orcid.org/0000-0003-3192-6538"
    }
  ],
  "dateCreated": "2022-03-21",
  "accessionID": {
    "name": "PBARC",
    "url": "https://www.ars.usda.gov/pacific-west-area/hilo-hi/daniel-k-inouye-us-pacific-basin-agricultural-research-center/"
  },
  "instrument": [
    "Example sequencer"
  ],
  "voucherSpecimen": "Synthetic example; no physical specimen",
  "scholarlyArticle": "10.1093/bib/bbae122",
  "funding": "funding",
  "reuseConditions": "public domain",
  "documentation": "Synthetic metadata and sequence; identifiers are placeholders unless explicitly verified.",
  "masking": "soft-masked",
  "identifier": [
    "beetlebase:TC010103"
  ],
  "relatedLink": [
    "http://wfleabase.org/genome/Daphnia_pulex/dpulex_jgi060905/fasta/"
  ],
  "checksum": "AAAAAAAAAAAAAAAAAAAAAAAAAAAAAAAAAAAAAAAAAAA=",
  "assemblySoftware": [
    {
      "name": "hifiasm",
      "version": "0.19.8",
      "uri": "https://github.com/chhylp123/hifiasm",
      "commandLineOption": [
        "-t",
        "2"
      ]
    }
  ],
  "assemblyProtocol": "https://example.org/assembly-protocol",
  "vitalStats": {
    "N50": 16,
    "N90": 16,
    "L50": 1,
    "L90": 1,
    "totalBasePairs": 16,
    "numberContigs": 1,
    "numberScaffolds": 1,
    "gcContent": 37.5,
    "readTechnology": "HiFi"
  },
  "seqcol_id": "AAAAAAAAAAAAAAAAAAAAAAAAAAAAAAAA"
}
